Product,Review,Rating
Wireless Earbuds,Amazing sound quality and very comfortable to wear. Battery life could be better though.,4
Wireless Earbuds,Stopped working after a month. Very disappointed with the quality.,1
Wireless Earbuds,Great value for the price. Excellent bass and clear audio.,5
Smartphone,Super fast and the camera quality is top-notch. Highly recommend!,5
Smartphone,Not worth the hype. Overheats easily and battery drains quickly.,2
Smartphone,Perfect for gaming and multitasking. Smooth performance overall.,5
Bluetooth Speaker,Compact design with powerful sound. Love it!,5
Bluetooth Speaker,Distorted sound at high volume. Expected better quality.,3
Bluetooth Speaker,Very affordable and works great for small gatherings.,4
Laptop,Blazing fast performance and excellent build quality. Worth every penny.,5
Laptop,The screen started flickering after two weeks. Not impressed.,2
Laptop,Good for casual use but struggles with heavy software.,3
Smartwatch,Tracks fitness accurately and has a sleek design. Battery lasts all week!,5
Smartwatch,Not very user-friendly. The app crashes frequently.,2
Smartwatch,"Decent features for the price, but the strap is uncomfortable.",3
Gaming Mouse,Precise tracking and customizable buttons. A must-have for gamers.,5
Gaming Mouse,Feels cheap and the clicks are too loud. Not worth it.,2
Gaming Mouse,Good ergonomics and smooth performance. Perfect for long gaming sessions.,4
Action Camera,Amazing video quality and waterproof feature works perfectly.,5
Action Camera,"Battery life is terrible, and the app is very laggy.",2
Action Camera,Affordable and reliable. Great for beginners!,4
Headphones,Crystal clear sound and very comfortable to wear for long hours.,5
Headphones,The left ear stopped working after a month. Waste of money.,1
Headphones,Great noise cancellation and build quality. Highly recommend.,5
Tablet,Perfect size for reading and watching videos. Very responsive touch screen.,5
Tablet,Extremely slow and crashes frequently. Not happy with this purchase.,2
Tablet,"Decent for the price, but the battery doesn't last long.",3
Fitness Tracker,Accurate tracking and lightweight. Helps me stay on top of my goals.,5
Fitness Tracker,The display stopped working within a week. Very disappointed.,1
Fitness Tracker,"Good features for the price, but syncing with the app is a pain.",3
Keyboard,Super comfortable and the backlighting is a great touch.,5
Keyboard,Keys get stuck often. Makes typing very frustrating.,2
Keyboard,"Works well for basic use, but not for heavy typing or gaming.",3
Monitor,Stunning display quality and adjustable height is a plus.,5
Monitor,Arrived with a dead pixel. Disappointed with the quality control.,2
Monitor,Good size and clarity. Great for working from home.,4
External Hard Drive,Fast data transfer and compact design. Very reliable.,5
External Hard Drive,Stopped working after a few uses. Lost all my data.,1
External Hard Drive,Affordable and good storage capacity. Works as expected.,4
Router,Easy to set up and provides stable internet connection.,5
Router,Frequent disconnections. Wouldn't recommend.,2
Router,Good range and speed for the price. Perfect for small homes.,4
Power Bank,Charges my phone multiple times and is very lightweight.,5
Power Bank,Stopped holding charge after a month. Very disappointed.,1
Power Bank,Compact and reliable. Great for travel.,4
