Product,Review,Rating
Wireless Earbuds,"The wireless earbuds offer Bluetooth 5.2 connectivity, ensuring a stable connection with low latency. The sound quality is powered by 10mm dynamic drivers, delivering balanced mids and crisp highs. However, the bass could use more depth. Battery life is decent at 6 hours per charge, with an additional 18 hours from the charging case. The earbuds support touch controls but lack active noise cancellation, which is a drawback at this price point.",4
Smartphone,"This smartphone is equipped with a Snapdragon 8 Gen 2 processor and 12GB of RAM, ensuring smooth multitasking and high-performance gaming. The 6.7-inch AMOLED display supports a 120Hz refresh rate, offering vibrant colors and fluid visuals. The 5000mAh battery provides a full day of usage, and the 65W fast charging is impressive. The 50MP primary camera produces sharp images, but the ultra-wide lens falls short in low light. Lacks a headphone jack, which might bother some users.",4
Bluetooth Speaker,"The Bluetooth speaker features a 20W driver setup, delivering loud and clear audio with decent bass. It supports Bluetooth 5.0 and has a range of 30 feet. The IPX7 rating ensures water resistance, making it suitable for outdoor use. Battery life is up to 12 hours on a single charge. However, the speaker struggles with distortion at maximum volume and lacks an equalizer for audio customization.",3
Laptop,"Powered by an Intel Core i7-1360P processor and 16GB DDR5 RAM, this laptop excels in productivity and light gaming. The 14-inch 2.8K OLED display is stunning, with excellent color accuracy and contrast. Storage is handled by a fast 1TB NVMe SSD. Battery life is around 8 hours under moderate use. The keyboard offers good tactile feedback, but the trackpad could be more responsive. Lacks a dedicated GPU for heavy gaming.",4
Smartwatch,"The smartwatch runs on WearOS and features a 1.4-inch AMOLED display with Gorilla Glass protection. The fitness tracking options include heart rate, SpO2, and sleep monitoring, but advanced metrics like ECG are absent. Battery life is around 2 days, which is average for its class. The watch supports third-party app integration and comes with built-in GPS, though accuracy can vary. Build quality feels premium, but it's slightly bulky for smaller wrists.",3
Gaming Mouse,"This gaming mouse uses a high-precision 25,000 DPI optical sensor, offering exceptional accuracy for competitive gaming. The ergonomic design includes 8 customizable buttons and RGB lighting. It supports both wired and wireless modes, with a polling rate of 1000Hz. Battery life in wireless mode is approximately 70 hours. While the build quality is solid, the mouse is heavier than most, which might not suit all gamers.",4
Action Camera,"This action camera records 4K video at 60fps and supports image stabilization for smooth footage. The 12MP sensor performs well in daylight but struggles in low-light conditions. The waterproof design works up to 30 meters without a case. It includes Wi-Fi connectivity for transferring files and remote control through a companion app. However, the battery life is limited to 90 minutes of continuous recording, and the touchscreen can be unresponsive at times.",3
Headphones,"These over-ear headphones are equipped with 40mm drivers, delivering rich audio with a focus on bass. Active Noise Cancellation (ANC) effectively reduces background noise, though it can impact sound quality slightly. Battery life is up to 30 hours with ANC on. The ear cups are comfortable, but the plastic build feels less durable. The headphones support voice assistants and multipoint connectivity, which is a great addition.",4
Tablet,"The tablet features a 10.5-inch LCD display with a 2000x1200 resolution, offering sharp visuals for media consumption. Powered by an octa-core processor and 6GB RAM, it handles multitasking well but struggles with demanding games. The 8000mAh battery provides up to 10 hours of usage. The included stylus is useful for note-taking, but latency could be improved. Build quality is solid, though the bezels are a bit thick for 2025 standards.",3
Fitness Tracker,"This fitness tracker offers step counting, heart rate monitoring, and sleep tracking. It has a 1.1-inch OLED screen with a simple and intuitive interface. Battery life is excellent, lasting up to 10 days on a single charge. The tracker syncs easily with its mobile app, though advanced metrics like VO2 Max are missing. The design is lightweight and comfortable, but the silicone strap feels a bit cheap.",3
